{
  "schema_version": "kspacejet.operator-contract/v1",
  "kind": "OperatorContract",
  "operator_id": "reference_reconstruct",
  "operator_revision": "1.0.0",
  "provider_abi_major": 1,
  "supported_profiles": ["offline", "bounded-online"],
  "ports": [
    {
      "name": "acquisition",
      "type_descriptor": {
        "type_id": "ismrmrd.acquisition",
        "revision": 1,
        "payload_schema_digest": "sha256:aaaaaaaaaaaaaaaaaaaaaaaaaaaaaaaaaaaaaaaaaaaaaaaaaaaaaaaaaaaaaaaa",
        "payload_kind": "message_handle",
        "element_type": "none",
        "rank": 0,
        "dimensions": [],
        "layout": "opaque",
        "strides": "canonical",
        "explicit_byte_strides": [],
        "allowed_memory_domains": ["host_normal"],
        "min_alignment_bytes": 8,
        "mutability": "immutable_after_publish",
        "metadata_schema_digest": "sha256:bbbbbbbbbbbbbbbbbbbbbbbbbbbbbbbbbbbbbbbbbbbbbbbbbbbbbbbbbbbbbbbb"
      },
      "direction": "input",
      "cardinality": "many",
      "required": true,
      "layout_capabilities": [],
      "metadata_capabilities": []
    },
    {
      "name": "image",
      "type_descriptor": {
        "type_id": "ismrmrd.image",
        "revision": 1,
        "payload_schema_digest": "sha256:cccccccccccccccccccccccccccccccccccccccccccccccccccccccccccccccc",
        "payload_kind": "message_handle",
        "element_type": "none",
        "rank": 0,
        "dimensions": [],
        "layout": "opaque",
        "strides": "canonical",
        "explicit_byte_strides": [],
        "allowed_memory_domains": ["host_normal"],
        "min_alignment_bytes": 8,
        "mutability": "immutable_after_publish",
        "metadata_schema_digest": "sha256:bbbbbbbbbbbbbbbbbbbbbbbbbbbbbbbbbbbbbbbbbbbbbbbbbbbbbbbbbbbbbbbb"
      },
      "direction": "output",
      "cardinality": "many",
      "required": false,
      "layout_capabilities": [],
      "metadata_capabilities": []
    }
  ],
  "execution": {
    "input_granularity": "acquisition",
    "partition_key": [],
    "order_domain": "strict_global",
    "max_active_keys": 1,
    "max_in_flight": 1,
    "call_model": "serial",
    "max_items_per_activation": 1,
    "cooperative_quantum_us": 500
  },
  "batch": {
    "min_items": 1,
    "preferred_items": 1,
    "max_items": 1,
    "max_charged_bytes": 1048576,
    "max_wait_us": 0
  },
  "rates": {
    "kind": "sdf",
    "completion": {
      "kind": "end_of_input",
      "expected_count": 0,
      "on_end_of_input": "fail"
    },
    "static_phases": [
      {
        "inputs": [
          { "port_name": "acquisition", "items": 1, "charged_bytes": 1048576 }
        ],
        "outputs": [
          { "port_name": "image", "items": 1, "charged_bytes": 1048576 }
        ]
      }
    ],
    "ordinary": { "max_firings": 0, "outputs": [] },
    "normal_flush": { "max_firings": 0, "outputs": [] },
    "cancel_cleanup": { "max_firings": 0, "outputs": [] }
  },
  "resources": {
    "scratch_charged_bytes_per_firing": 0,
    "per_key_state_charged_bytes": 0,
    "per_scan_workspace_charged_bytes": 0,
    "retention_items": 0,
    "retention_charged_bytes": 0,
    "output_items": 1,
    "output_charged_bytes": 1048576,
    "cpu_permits": 1,
    "backend_gang_threads": 0,
    "provider_private_threads": 0,
    "external_allocation_charged_bytes": 0,
    "memory_domain": "host"
  },
  "calibration": {
    "role": "none",
    "binding_id": "",
    "key_projection": [],
    "single_epoch_v1": true,
    "max_active_keys": 0,
    "precalibration_horizon_items": 0,
    "precalibration_horizon_charged_bytes": 0,
    "max_calibration_frame_charged_bytes": 0,
    "max_decoder_staging_bytes": 0,
    "on_end_of_input": "fail"
  },
  "terminal": {
    "normal": "flush_declared",
    "cancel": "cleanup_declared",
    "normal_max_output_items": 0,
    "normal_max_output_charged_bytes": 0,
    "normal_max_async_tokens": 0,
    "cancel_max_async_tokens": 0
  }
}
